count,url,desc
3,/p/987689475,邮政储蓄柜员收入明细
0,/p/2136375394,邮政的网银系统也太他吗的垃圾了吧
3,/p/2168742596,在邮政，用平房的房产证能办理贷款吗
7,/p/2091170564,邮政储蓄绿卡通可以一卡多存多单定期存款吗？
2,/p/2098984894,【求解答】
1,/p/2127329484,邮政储蓄柜员多拿钱不告知存款者。收钱不验钱。谁保证我们的权益
10,/p/2159285045,邮政短信问题。
0,/p/2159440728,早两天转账到工行的业务停了，现在恢复了吗？
1,/p/2158741367,这个吧里我这种等级应该蛮高了而且我的帖子会一直靠前 你信么
1,/p/2113289406,求助！！！！我的网银登陆密码忘了
0,/p/2133158592,今天去邮政开通网银，出现了惊奇的事，我当时无语了
1,/p/2132530893,邮政储蓄网上银行有大BUG，服务太劲了，太官僚了！！！
0,/p/2130299596,提问
2,/p/2109762457,我网银密码和登户名忘了  怎么办
3,/p/2125892108,我今天去取钱忘了密码.输了三次..又拿身份证输了二次..明天
2,/p/2058673159,邮储银行是我见过的最垃圾的银行！！！祝你们邮储员工戴绿帽子
3,/p/2111051886,"我的邮箱银行卡在ATM上被气了,我还可以用存折存钱吗?"
1,/p/2102084484,问个邮政的问题
0,/p/2103775728,午安
0,/p/2099010096,为什么我打到手机停机了。邮政的热线还是没打通！！  紧急
0,/p/2098999294,邮政的客服真垃圾，打电话打的停机也没人接。
1,/p/2059077609,我能哭会么？真的要失去自由了
2,/p/2089275550,邮政储蓄银行的行长，我鈤泥酿！滥发垃圾短信！
7,/p/1986185400,  有问题求助。
2,/p/2055565340,、我感觉不会在爱了、我今年十三岁
1,/p/2059051027,低调路过
1,/p/2059057806,问下！！！我今天刚开通的网银改了密码后，我在家登陆就是进不了
0,/p/2096028659,刚在ATM机存钱被吞，吐出卡打印凭条，现在卡又掉了我赶紧办挂失…
44,/p/6038914,取款机吞款，该找谁要
0,/p/2094967703,C尼玛邮政储蓄。。尼玛客服电话假的吧
2,/p/2059670627,请问现在的邮政储蓄所的奖罚情况？
1,/p/2093428743,春节快到了~~~~~~~~~~~~~~~~~~~~~~~~~~~~~~~~~~~~~~
0,/p/2093425606,签到签到 签到签到
0,/p/2085228146,急，求帮助
2,/p/2081541494,绿卡可以给支付宝充钱吗？
0,/p/2081435582,各位，计息题怎么做啊？完全没有头绪……
0,/p/2080028683,高富帅都会有什么烦恼
0,/p/2059074339,我是新人，求罩，求认识，求关注，没人理我
0,/p/2059066225,邮储求教导
0,/p/2059036927,光棍节要到了
3,/p/1983034594,支不出钱怎么办
3,/p/1983835584,问下！！！我今天刚开通的网银改了密码后，我在家登陆就是进不了
1,/p/2028324159,我是新手求照顾
3,/p/2021876757,我想办张邮政淘宝卡求介绍求大神
0,/p/2058566335,邮政卡异地转账怎么收费
0,/p/2056618561,问下跨行转账问题
0,/p/2055582911,_______________________
0,/p/2055567807,圣诞节想给女朋友收集100个祝福的视频 有没有帮忙的？ 谢谢大..
2,/p/1969255466,、我感觉不会在爱了、我今年十三岁
0,/p/1983856805,偷偷的告诉我，你在思念谁！
1,/p/1968671203,【我想吃好吃的】
4,/p/2051896921,我说你们能负责点么
0,/p/2051393633,求解答充值支付宝
0,/p/2047404993,急
0,/p/2045750421,从上海邮递台式电脑到贵州福泉大概几天到？
1,/p/1983826951,你让我说什么好呢
1,/p/1968838081,xinrenqiurenshi
1,/p/1979711191,问一下利率的问题
0,/p/1968493384,我能哭会么？真的要失去自由了
0,/p/1968341985,偷偷的告诉我，你在思念谁！
0,/p/1965322231,报个到，我也是邮政储蓄的。
5,/p/1802115300,办卡得多少钱
1,/p/1957119813,求解：去邮政打钱的时候，工作人员说网络繁忙钱暂时打不进去，等
0,/p/1954279285,郑州 大学路与桃园路 交叉口的 邮政储蓄银行
0,/p/1954278133,郑州 大学路与桃园路 交叉口的 邮政储蓄银行
0,/p/1946477723,柜员机出问题了
0,/p/1941679777,今天邮政手机银行怎么登陆不了？
0,/p/1937815915,邮政营业员
1,/p/1895501764,怎么夸行汇钱
1,/p/1932512853,登陆不了
1,/p/735525353,山东省新泰市羊流镇农业银行的领导和工作人员全是芋头（除了贵宾台
3,/p/1287275973,公道在哪里！！！爆邮政储蓄内部新闻！！
1,/p/1918919588,求解  求远程
46,/p/373421918,"江西邮政储蓄银行的待遇,福利."
2,/p/1872382949,公布一个邮储的死骗子
0,/p/1902195752,在学校的邮政储蓄自动取款机取出假币，这到底怎么会事？还不给换
0,/p/1902048696,乡下的邮政所今天有上班吗？
7,/p/1834799372,今天去邮政存钱，短信回复说现金额……然后余额……这样是存上了
2,/p/1890983394,邮政 储蓄 十年 临时工 每月850元人民币 向好心人求助
2,/p/1844323155,钱怎么缩水了
7,/p/1781041812,用邮政卡的朋友注意！！！
0,/p/1898619078,我刚才去 银行改密码了 他让我重新注册一下
0,/p/1890492603,邮局内部的大神，有一事相求
1,/p/1884991335,"我的存折和银行卡是绑在一起的,别人往我存折里打钱，卡里会增加…"
2,/p/1736507927,月之后才看到单子上面的数目少了一万…这是怎么回事？
1,/p/1764658537,问个营业问题
0,/p/1876827800,省内异地汇款手续费怎么收的？1万收多少？在线等
1,/p/1872012982,邮政卡没丢，邮政储蓄没丢，卡里钱丢了，这是谁的责任？
0,/p/1869605466,邮政储蓄异地存款是怎么扣费的?
18,/p/1407012425,为什么几天中国邮政的个人网上银行页面打不开
1,/p/1766796141,。。
1,/p/1797747647,邮政储蓄卡可以一折多卡么？求解
2,/p/1828847184,问一问题，昨天开的户，开户单给了柜员啥都没问就给我开卡了，会
1,/p/1802271641,在邮政储蓄存了5800元，出来的单子只有4800元？？
1,/p/1820130882,求员工解答
2,/p/1802466859,为什么每年农行要扣年费10元啊，利息还不够扣，那我们存钱干什…
9,/p/1330628936,邮政储蓄太坑人了
10,/p/1493898897,江苏南京江宁区殷乡邮政储蓄真的很烂哎
16,/p/1682797387,邮政局任务过重、八年老职工不得不下岗
5,/p/183316444,在邮政储蓄做营业受夹板气！！
1,/p/1834960277,请楼主删除河北魏县车往镇邮政储蓄银行存在的安全隐患这个帖子
0,/p/1833541464,河北魏县车往镇邮政储蓄银行存在的安全隐患
0,/p/1826929758,求救啊，给跪了。各位银行的哥哥姐姐们帮个忙吧。本人在校大...
2,/p/1821836307,怒啊，我想破口大骂邮政储蓄！！！！
0,/p/1823138526,请问西安明德门这边的工作人员
0,/p/1816656184,6221887131012677883是小偷，谁能查到他是谁
0,/p/1802743524,邮政储蓄会不会划过银行啊，？
0,/p/1800337012,还要这个吧 国家电网的路过
1,/p/1798790805,我们这边的邮政储蓄现状。
0,/p/1793253954,邮政网银真坑爹，吞我100
0,/p/1786235139,一毛三分钱的怨恨
0,/p/1778648726,（求助）有张邮政卡半年没用 还有五块钱 会被注销么 以前绑定手机了
6,/p/1694718998,问一点和邮政储蓄有关的问题，专业人士给点意见啊
0,/p/1776064472,600块钱被取款机吞了
0,/p/1766320618,问问问。邮政卡是不是有亲子卡，母子卡什么的?
1,/p/1737669323,为什么？卡里的钱会不明不白的少了。求助、求解释。
5,/p/1699543048,我想问一下邮储的合同工和正式工的区别在哪啊，合同工有晋升空…
2,/p/1728637452,有没有邮储的相关工作人员能回答我的问题？~~~
1,/p/1731864888,求助。。我在北京办的绿卡在张家口丢了 怎么办啊 T T
0,/p/1734625935,急急急.开户银行怎么查啊
4,/p/1728477261,问个问题
1,/p/1718000367,求解
2,/p/1699073494,邮政要怎么汇款啊？
1,/p/1715802490,请问我老婆的定期存单没到期，我可以取吗》急用
0,/p/1713815684,请教黑龙江的邮政储蓄的派遣制营业员怎么样？收入和待遇之…
2,/p/1533062276,曝光李彩莹残害邮政西安分行信贷员的血泪史3
4,/p/1550858904,邮政储蓄工作好吗
14,/p/166672281,邮政储蓄.你的服务态度太差了
0,/p/1683170177,怎么开通邮政手机短信提醒？
0,/p/1668558505,陶行长你还好吗？你是我们学习的榜样。
1,/p/1669215500,求助   求助大神
1,/p/1664786952,卡两个月左右前被冻结了，学校补贴可以汇给我吗？
0,/p/1664232108,全是匿名狗
4,/p/1625619942,乱哄哄的西安邮储银行-----记李彩莹管理下的西安邮储
66,/p/89809517,邮政储蓄就是垃圾！！！！
2,/p/1359643833,赠保险
2,/p/1606989193,内蒙古邮政储蓄可真黑
1,/p/1610137786,邮储银行服务不是一般的差
1,/p/1596597992,大家帮忙回答一下，谢谢了
0,/p/1625403781,大家```中午签退时```不小心按成机机构签退了```是什么个情况```
0,/p/1623113299,我想知道一个卡号的 用户资料
0,/p/1622405450,肇庆邮政储蓄银行现在的行长是谁？主要领导叫什么？
0,/p/1622402353,肇庆邮政储蓄银行现在的行长是谁？主要领导叫什么？
0,/p/1621298092,大家谁知道给说下怎么办！！！我很愁
0,/p/1618027840,大庆邮政储蓄太他妈累了 不是人干的活 企业应该加强管理了
0,/p/1565784564,福建高仿真烟 全国货到付款 电话 15014134741 QQ 730074695 @
2,/p/1573151029,西安邮储黑幕掌控人李彩莹
2,/p/1493439035,为什么邮政储蓄储10万银行里面的人还要给你100快钱
0,/p/1596592329,大家帮忙回答一下，谢谢了
2,/p/1586808788,谁能告诉我邮政储蓄网银卡收费是怎么收的？
2,/p/1450205905,你们首季存款多少任务？
0,/p/1583536463,信用卡申请资料填写移动号码，拒绝短信发到联通号码上，第五次
1,/p/1582298174,邮政储蓄，我真的对你无奈了。
3,/p/1583446594,求助！
2,/p/1574279746,邮政储蓄，派遣岗，项目管理
1,/p/1579753905,邮政储蓄，求助……
2,/p/1446150231,邮政的信用卡这不是侮辱人嘛
0,/p/1578369775,姐给你们讲讲我的生活，看你们过的是不是比我幸福
0,/p/1567499375,拿到证券从业后那么用这个证书？
1,/p/1550619854,坑爹的邮政储蓄
1,/p/1554465439,现在跨行转账手续费多少
1,/p/1549091033,"急急急求大神解,关于邮政跨行网上汇款!"
1,/p/1548094111,问问大家，帮帮忙
1,/p/1533062280,曝光李彩莹残害邮政西安分行信贷员的血泪史2
4,/p/1543383465,骚年。 今天你被（短扣）了吗。坑爹的邮政!
3,/p/1498296073,甘肃天水邮政储蓄银行2012年还有社会招聘不
0,/p/1521995680,被扣划
0,/p/1501544221,朝阳叶柏寿邮政储蓄信贷员一手遮天
0,/p/1500000854,各位大侠 帮帮忙
0,/p/1516784397,求帮助
0,/p/1510348367,我在衡水工商银行也取到过
0,/p/1496291653,领叫过邮政储蓄服务的人
1,/p/1493794863,吧里有人在吗？吧主在吗？帮帮我……
7,/p/1472807832,请问我的淘宝卡找到了 可以解除挂失吗
1,/p/1485266106,邮政储蓄服务太差了 还好我卡里面没钱  我去挂失  都不能
1,/p/1485230498,我孩子的身份证与银行卡被盗 我拿户口本去挂失  都不能挂失
0,/p/1484807215,【邮】 圆◤中华文化大复兴<组图>◥圆
4,/p/1427907565,邮政储蓄的绿卡通能支付各种考试的网上报名吗？
5,/p/1418261135,邮政储蓄新开户问题
6,/p/1187087743,邮政的网上银行登不上，谁来帮忙啊！
14,/p/661659098,请问邮政储蓄36元的手机年费是怎么回事？
0,/p/1475852965,本人每月从浙江省台州市打到安微省亳州市1000元、汇费我已经在台
0,/p/1475850950,问问
0,/p/1471222518,银行卡问题
0,/p/1468240652,咨询个问题。邮政储蓄卡和邮政存折 所显示的金额不一样呢？
0,/p/1467563252,【急】大家帮帮忙
0,/p/1465276598,不想再卖保险，于是辞职了
2,/p/1463506585,请教个淘宝卡问题 懂得大侠进下。
0,/p/1461007910,【求问】福州闽侯汽车城营业所的邮政储蓄的ATM能无卡存款的吗
14,/p/1134098785,千万不要去邮政储蓄存款！
0,/p/1459091482,急！07年到现在一直没用过的邮政卡还能用吗？
11,/p/1348026145,【求助】那啥。我想问问邮政银行16岁可以开通网银不哦？
0,/p/1454576153,邮政绿卡通（借记卡）已在柜台开了网银，登陆后怎么查询具体余额？
1,/p/1435408754,求大家帮个忙都来解答下！
2,/p/1444490703,未成年有身份证可以办邮政绿卡么？可以开通支付宝卡通么？不开通
1,/p/1425587423,求一枚邮政百事通卡！
0,/p/1445464983,  邮政储蓄 。
0,/p/1445152503,爱爱
0,/p/1436995402,问问
0,/p/1436601627,邮政储蓄信审人员和客服就是这样忽悠人！
0,/p/1436525171,邮政储蓄银行的工作人员杂都没诚信呢？？？
0,/p/1436458221,坂上 邮政储蓄 淘宝绿卡
0,/p/1431767301,贴吧有Q群没，希望有前辈指导一下
0,/p/1428854661,想开通网银，哪个银行好
6,/p/1254882836,小妹请教大家一个问题
2,/p/1423983975,想求大家帮一个忙，在线等，都来帮我解答下好吗，谢谢大家
1,/p/1422684997,大神帮忙看看什么情况…急……
0,/p/1421301439,安徽邮政储蓄银行 员工等级问题
1,/p/1415327852,这是什么事啊！谁能告诉我怎么回事？
1,/p/1404488148,求邮政储蓄卡资费说明
2,/p/1415320496,急急急~~~~
9,/p/892356426,邮政储蓄银行骗人太平人寿忽悠加蒙人
0,/p/1416850812,邮储啊邮储，快给咱开工资吧啊啊啊啊啊啊啊啊啊。。。。。。。。。
1,/p/1413894618,邮政储蓄存单变保单--你被骗了吗
5,/p/1074315930,一年五千存三年，六年后支取。朋友你们受骗了吗？
16,/p/738799894,天津宝坻邮政储蓄的头头居然袒护员工搞破鞋！
5,/p/1198770091,投诉邮政储蓄存单变成保单
1,/p/1355801846,邮政储蓄，烂货
4,/p/1351105411,邮政储蓄的陷阱——-用你的存款买保险
1,/p/1411515558,在邮政储蓄存钱，却被欺骗买了人保寿险金鼎富贵两全保险
0,/p/1410030693,邮政储蓄异地转账问题
0,/p/1408384867,好吧，我被邮政储蓄骗了。
1,/p/1407367284,信用卡莫名费用哪来的
4,/p/1366918246,四点过半，号码未过，为何立刻关门不让进？
1,/p/1403904496,请问邮储的风险合规部是做什么的，工作怎么样啊
12,/p/1301167711,我是2011年8月份进邮政的员工，希望朋友们来听我说说我的工作！
12,/p/1379498912,去你大爷的邮政储蓄
220,/p/97234059,一个邮政储蓄营业员的悲伤~！·请大家给予支持，。谢谢了
1,/p/1403676776,邮政储蓄，我日，5000块钱取了两天，都由于邮局没钱取不出来！日！
4,/p/1339529490,邮政不配开储蓄银行！！！
12,/p/1295939645,该死的，四点就下班
4,/p/1381024785,求明白人给答复！！！！万分感谢！！！！
6,/p/1363166617,好奇怪的事情，谁遇到过？
4,/p/1365870598,邮政储蓄，你真的让我无语了！！！
0,/p/1393148134,"邮政储蓄网银问题《高手进,其他人也欢迎》"
0,/p/1387972676,邮政业务
1,/p/1386505784,邮政储蓄信用卡审批中心的工作人员进。。
1,/p/1349291920,一张身份证能开几个邮政网银？
1,/p/1385728222,什么是汇总压？? ?
9,/p/1209858843,各地势来晒一下你们的工资
3,/p/1383387492,邮政开网银前让我先开短信，网银免费，后来发现平白无故的少了30块
2,/p/1355179128,邮递员同行们！我告诉大家如何工作能轻松一半的方法
1,/p/1366765561,怎么才可以知道别人有没有在邮政银行存钱
1,/p/1324920567,激活邮政储蓄银卡要带什么
2,/p/1263864857,不是本人的折子，提醒需要换折了。
1,/p/1338681253,邮政储蓄卡密码错误被锁定，办卡人不在本地，没身份证能解锁吗 急！
0,/p/1355814262,近亲结婚的产物
0,/p/1347778776,求援助
2,/p/1301242295,邮政取款，卡片信息不合法是什么意思哦
3,/p/1329644216,邮政储蓄早上上机的时候需要打印什么报表？
1,/p/1345013803,熟悉先进汇款的进来一下
1,/p/1341991613,邮政储蓄开户必须要办理短信提醒么？？？？
1,/p/1329364936,急急急！！我的邮政储蓄卡啊
2,/p/1338351006,乱收费挖，伤脑筋
0,/p/1337582478,急急急询问待遇
1,/p/1336266785,湖北鄂州吴都邮政储蓄工作人员态度太恶劣了
0,/p/1336924067,包头 邮政储蓄 霸王条款 乱收费
8,/p/1298690671,该不该去邮政储蓄上班呢，请大家帮忙指点下，纠结。。。。。。
5,/p/1068604875,UK的工本费怎么收
0,/p/1333195822,寻人启事：邮储员工素质之低下，欢迎对号入座！
0,/p/1329993783,邮政储蓄领到假币
1,/p/1328125428,谈谈邮政储蓄的“任务”
0,/p/1329755388,支付宝卡通业务签约怎么弄？
1,/p/1325160551,我刺啊，邮储兼职木素质！！
0,/p/1325125955,吧友们，有个问题想请教
2,/p/1317945792,邮政网上银行我c你@妈
1,/p/1321236114,可以去中国银行往邮政储蓄的卡上打钱么？
1,/p/1323044083,急急急！！！我现在人在武汉，但是银行卡绿卡通是在南京办的怎么注
3,/p/979834894,我是湖北黄石的，那个存单和密码双挂失怎么那么难办啊！！！
0,/p/1313285308,焦作市修武县邮政储蓄给新用户开户为何强制收取30元短信业务费？
4,/p/1261612460,邮政，邮政储蓄，和邮政储蓄银行的区别
0,/p/1308195796,银行专业人士速来帮忙===--求助~！！
0,/p/1307306642,请问山东潍坊这边邮政储蓄银行信贷员待遇怎么样?(正式工）。
5,/p/1302179843,请问县级邮政储蓄银行劳务派遣工待遇
0,/p/1306061838,邮政储蓄
0,/p/1303173074,求帮助
0,/p/1301139839,今天在存款机上存钱，钱被收回了，是怎么回事
2,/p/1285943899,邮政储蓄几点上班几点下班？
0,/p/1294783393,挂失要七天
6,/p/1122303265,地产老板进
0,/p/1292478271,太原吴利平
3,/p/1287296995,请网友主持公道
0,/p/1290247426,急急急，求解答
18,/p/405088383,天津邮政储蓄银行出假钱了!!!!!!!!
0,/p/1289065024,郁闷
1,/p/1251358303,邮政储蓄有虚拟帐户？
23,/p/615017262,我命真叫苦 瞎眼进邮储
1,/p/1256654483,"求助,银行卡被吞,卡不是本人的~急啊"
2,/p/1273824612,求解释邮政储蓄账户本上摘要栏里填压缩是什么意思。。。。万分感谢
0,/p/1275824252,邮政储蓄出假币
6,/p/1266665512,谁能跟我解释一下，这坑爹的邮政储蓄网银！！！！！
0,/p/1269008784,我已在网上开通了网上银行，可以不能签约加办那些什么的服务。
1,/p/1260987826,关于这个问题？懂邮政储蓄业务的帮下
0,/p/1265011308,谁办过邮政的红福宝业务，知道存进去的钱几年后还能取出来吗？
1,/p/1254636918,卡丢了，存折还在，可以直接销户吗？
0,/p/1261647365,挂了失也照样吃钱
3,/p/1255928001,定期存款人去世了怎么办？谢谢
2,/p/1250042803,【请问】邮政存折，不是本人能取出来的金额是多少？
0,/p/1248630850,不能取信于民的企业，就是灭亡的开始！
1,/p/1244353514,能异地存款吗？
0,/p/1244836225,骗子绝对的骗子我日他妈
0,/p/1244827471,邮政网银转账后可以申请退回转账汇款吗
3,/p/1237888520,【提问】学校办的邮政卡，想销户，现在毕业又回不去
1,/p/1226641005,【请问】折销户必须去开户行才能消掉吗？
0,/p/1240850115,中国邮政支付网关吧欢迎各位亲们的到来
0,/p/1239705397,绿卡通挂失后
2,/p/1209274071,坑爹的邮政储蓄，谁再用谁是孙子！！！
1,/p/1222678922,菜市场邮政。
0,/p/1234652686,个人网上银行抽风
1,/p/1225060676,邮局领导们，为啥给我们那么多的强制销售任务？
4,/p/1221157815,╮(╯▽╰)╭淘宝绿卡简直是鸡肋
1,/p/1226529413,刚办得邮政卡能取钱吗？
0,/p/1226721566,谁能给我意见
0,/p/1224510969,邮政储蓄垃圾垃圾垃圾啊！!!!!!!!!
0,/p/1224100150,请问我的卡没有开通网上银行 能登陆吗
0,/p/1222907235,有亲对中国邮政支付网关和中国邮政储蓄银行网上银行感兴趣吗？
0,/p/1222680718,吴利平
1,/p/1187034453,今天刚办了一张绿卡、可是不会取钱、大家能说说过程么？
1,/p/1221642024,紧急求助：上午在邮政柜员机给朋友打了点钱，为什么到现在还没收到
0,/p/1219921582,发钱之日就是罚钱之时-黑的发紫的邮政
1,/p/1213531232,操 尼玛就TM一垃圾骗子银行
0,/p/1217748651,绿卡通双币种
1,/p/1206774944,银行卡挂失
2,/p/878251078,淘宝绿卡问题
3,/p/1149764692,天津邮政储蓄 蒙骗客户购买保险
3,/p/775270311,交接班的时候整版的钱没数，后来发现又一个整版的少了10张怎么办？
1,/p/810006397,广东省电白县几乎全部教师工资帐户（邮政储蓄）被人莫名其妙取款，
3,/p/815706333,储蓄挂失为和那么难？
3,/p/846624934,存折消磁 用身份证复印件可以么
5,/p/619379279,"中国邮政邮递员说""要不是穿着制服早他妈下车揍扁你""结果还真来揍"
1,/p/882787553,如果我是一名普通的邮政储户
1,/p/883173423,邮政储蓄，用词不要卖弄高深
0,/p/1213022233,焦急的等待
1,/p/1210275596,谁知道这是什么情况？
2,/p/1197880282,想知道如何取消短信通知业务吗？不用上前台，轻松做到。
1,/p/1166126382,我脾气一向很好，今天去邮局汇款见识了什么叫恶劣
37,/p/482985018,请邮政人员或开通了邮政储蓄卡网上查询余额的人来帮帮忙！
0,/p/1208255784,邮政储蓄今天上班么
0,/p/1206115467,北京东单投递站具体位置在哪？
0,/p/1205199993,"我有个问题希望大家来帮助解决,比较急   !!!!!!"
0,/p/1203924563,请问邮政储蓄存折能不能在网上查余额啊？？
0,/p/1198713539,户外广告【新型媒体-110警示牌】
4,/p/1180287711,明天参加面试，有经验的给点意见
1,/p/1194950173,我的卡办了补办，我的存折还可以取钱吗？
2,/p/1196221999,学校办的邮储卡一次没用，要不要注销啊？真心求解
2,/p/1196060933,卡丢了能补一张跟原卡号一样的卡么？？
0,/p/1196724592,求解
0,/p/1196220775,学校办的邮储卡一次没用，要不要注销啊？真心求解
0,/p/1195142221,邮政人员是个宝
0,/p/1194354943,贷款利息多少！农村怎么贷款
1,/p/1173712540,为什么我在移动交话费显示pc00s3
2,/p/1184261647,可怕的邮政储蓄
0,/p/1190927916,问一下关于网银的问题
1,/p/1185906970,河北省廊坊市邮政局领导雷人语
0,/p/1187306079,邮政储蓄信用卡24小时无人客服热线！
0,/p/1185104191,真的服完了、。。。
0,/p/1181935554,吃饭
1,/p/1171650272,邮政绿卡本省跨市存取款收费么
3,/p/1156274438,邮政储蓄的各种推销是真的吗？
0,/p/1173031435,"警惕!!!!!!!金种子优选投顾现在已经赔了快10%了,有买的要注意自己的"
0,/p/1172382857,邮政储蓄柜员制。
0,/p/1169576251,大张庄邮政储蓄真垃圾
1,/p/1154334725,我们这里要改柜员制了，以前一直都是复核制
1,/p/1157483540,急问一下我的工资卡挂失了，单位发工资了，能打进去不
0,/p/1162519390,邮政储蓄贷款太那个了......
0,/p/1161840021,下刚工人不同
5,/p/1109598270,邮局储蓄累死人
1,/p/1140274469,请问邮政储蓄陕县张村所两个女员工上门收款符合要求吗？
3,/p/1157937489,网银怎么显示登陆错误哇
0,/p/1150861085,太原邮政储蓄总行有领导是贪官
28,/p/11411039,邮政储蓄?
0,/p/1146783527,关于邮政储蓄面向社会招聘都考什么啊
4,/p/1097049574,邮政储蓄真sb
0,/p/1146375455,为什么1个月前可以直接办卡，现在就要挂失还要交手续费？
1,/p/1146323598,临沂兰山邮政储蓄
3,/p/1074452433,菜鸟新手求邮储真相？
1,/p/1100768112,问一下、在邮政能往农行或者建设的卡里打钱吗？有知道的吗？谢了
2,/p/1128550518,邮政储蓄的卡丢了怎么办？！
1,/p/1138895403,这里有邮政储蓄工作的人没 我想问几个问题啊啊
0,/p/1144334609,请问，我的邮政卡丢了能补吗？收费吗。。。
0,/p/1140447223,请问邮政储蓄网点能查本人的定期存款开销户情况吗？
0,/p/1138120574,扬州邮政储蓄的人有木有
2,/p/1122676270,前辈们。我刚进邮政营业。。
1,/p/1129262687,靠你妈  ，邮政储蓄
0,/p/1131319407,邮政网银密码没错啊
1,/p/1126887480,"关于绿卡和存折的记录问题,急 ........"
10,/p/1026978994,请教各位前辈 今天签了中国邮政的A类工 金融岗位的 ~~~~~~~~~~~~~~~
3,/p/1096779952,什么破邮政储蓄啊
2,/p/1125681445,邮政储蓄真他娘贱！明明写存款110，还多给了2块手续费，居然存108
3,/p/1096294087,求各位帮助！！！
2,/p/873486736,邮政储蓄高管还在不？无耻业务员！！！有谁来管
1,/p/1112098063,邮政储蓄异地汇款，手续费是扣卡里的钱吗？
0,/p/1118235059,求助
0,/p/1115935215,求解答、急！！！
0,/p/1114799027,吧里有人办过『腾迅QQ联名卡』么？
14,/p/869786440,邮政储蓄卡被吞，带身份证去取卡竟然要提供卡号，否则不给卡，有这
0,/p/1111738089,谁办理了分红保险
1,/p/1109430764,信…急丫…
0,/p/1109325190,短信动态密码
0,/p/1108608869,甲鱼的臀部。
2,/p/1106228428,邮政储蓄的月收入和面试题目~~急！！！
0,/p/1106852412,急急急！！！谁有  邮政储蓄业务员模拟试题三答案  啊
1,/p/1098297354,苍南县邮政局
17,/p/1096078832,今天邮储是不是瘫痪了？官网进不去，电话打不通
9,/p/989472772,请教，关于解锁。
5,/p/1067654379,51那天 在距离不到开户银行30里的地方提款收了百分之6手续费！！
2,/p/1091824100,这是保险还是存款
0,/p/1093688523,请问邮政储蓄银行有没有“随薪贷款”。
