count,url,desc
1,/p/4132651194,邮政推荐办理富德生命一号保险，
5,/p/4143999193,有没有大神
8,/p/4143648711,我该怎么办，钱莫名其妙的不在
9,/p/4046743983,银行卡里钱不翼而飞？？怎么回事 ？？求助
3,/p/4143304497,关于集中授权
0,/p/4125968401,邮政储蓄的【绿卡通华西健康卡】无法进行网上挂号
0,/p/4114745627,消费者权益考试正式考试
1,/p/4107995172,大家有见过这种转账截图吗？别人
0,/p/4104404301,邮政储蓄 鑫鑫向荣 理财产品怎么样？
0,/p/4101127056,定期存款条遗失怎么查不出存的钱找不到怎么办
0,/p/4099932722,我的支付宝密码被锁定了，用人工
2,/p/4050354139,邮储银行商城网站如何兑换
2,/p/4050446427,请问大神们邮政储蓄保本型理财产品安全度怎么样呢？求解答
2,/p/4050398806,"用邮政储蓄卡在k歌里买花,怎么说手机预留号码与本卡不符"
2,/p/4050348016,邮储十条禁令第五条你有什么体会
2,/p/4000625275,邮政卡改银行预留手机号
5,/p/4069763559,我朋友今天中午用支付宝给我转账
3,/p/4083873283,别人通过支付宝10.2周五给我
3,/p/4018921615,什么是电子现金啊，存错了，电子现金怎么用啊？？？
1,/p/4078183846,取消预留手机号
0,/p/4085873699,和邮政缘浅
1,/p/4025177446,谁买过鑫鑫向荣B款啊，有风险吗
2,/p/3985616169,邮政储蓄到底是否能存活
4,/p/1899890348,邮政网银，个人网上银行登录打不开。
4,/p/4049922220,邮政储蓄信用卡注销
1,/p/4050275680,邮储银行鑫鑫向荣份额一份是多少
1,/p/4050315582,6217992610067912535是邮政储蓄哪个地区的卡
1,/p/4050647214,邮政储蓄啥时扣下年短扣费？
1,/p/4053210695,邮政储蓄滑县支行行长王卫玲和客户经理李娜的事大家知道吗
2,/p/3666969906,我挂失补办一张邮政卡！亲戚往老卡里转账成功而我没收到怎么办！
0,/p/4050729996,填写中国邮政储蓄银行借记卡(尾号5133)的信息是啥意思
0,/p/4050332386,总部基地邮储软件开发中心在哪
0,/p/4050301074,6217992610067912535这是邮政储蓄哪个地区的卡
0,/p/4050268103,6217992610067912535这是邮政储蓄哪个地区的卡
0,/p/4050246710,怎么样告诉viv0我的邮储银行停止运行
0,/p/4049500162,邮政储蓄农村网点秋季招收什么时候报名哪位知道啊
1,/p/4031329126,邮政活期储蓄卡被盗刷9000。
0,/p/4040380810,个人贷款
0,/p/4040375545,个人贷款
0,/p/4039952322,求解:微信红包and邮政储蓄
1,/p/3996168696,保过
1,/p/3912836052,交易明细不明也不细
1,/p/4006082318,消费者权益考试都考了吗
1,/p/3715014358,别人给我汇款，卡号输错了一位要多久退回
1,/p/3736025273,怎么卡上没到？
14,/p/737835701,邮政卡消磁还要去开户地换卡吗？
2,/p/3981327483,邮政储蓄强买强卖
6,/p/3738656479,别人用支付宝给我邮政卡转账要多久才能到啊
1,/p/4008104923,垃圾
2,/p/3976864024,河南省扶沟县邮政储蓄牛逼
2,/p/3937795680,求教
6,/p/3981277950,邮政 我日了你亲妈了
0,/p/3990908708,求问大神，办理邮政储蓄金卡需要什么条件
2,/p/3986012107,邮储还能支撑多久
4,/p/3979384642,星期一支付宝转账还要那么慢？
3,/p/3983216602,支付宝转账到邮政等二天一定会到吗
2,/p/3975176007,在邮政存定期莫名其妙给我弄成保险！求支招啊，大家有遇到吗？
1,/p/3979401850,4006695580是邮储信用卡的客服电话吗
0,/p/3989414415,邮政储蓄一个月透支500元多少利息
0,/p/3989401586,拍邮政储蓄卡就能把钱转到保险里吗
0,/p/3986005086,邮政储蓄还能支撑多久
2,/p/3982994107,福利贴
8,/p/3926647663,昨天刚在邮政办了张卡，今天就少了30 百度了下是传说的短扣
2,/p/3948942874,支付宝问题
19,/p/3959405205,在邮政里存定期，结果给我一张什么人寿保险怎么回事？求解？？？？
0,/p/3897735595,理财风险评估
3,/p/3977266363,关于信用卡分期的问题
4,/p/3943067503,新帖！邮政存款1000定期送手机
2,/p/3962113855,存了两年定期，成了两年保险，刚半年想取出来
2,/p/3940151518,服务人员态度恶劣
0,/p/3964781739,大家千万别用邮政的卡
0,/p/3952832081,这个我真搞不懂啊。。
2,/p/3948422527,邮政信用卡马上到期了，怎么办
0,/p/3942333020,求解
0,/p/3939701501,邮政办网银需要些什么
2,/p/3851438607,邮政储蓄今年工资改革问题。
1,/p/3938153199,求助
1,/p/3933625523,关于国外大学应届毕业生身份划定的问题
1,/p/3922673800,请问邮政储蓄岗前培训一般多长时间啊，中途有没有休息日啊
6,/p/3717196010,邮政卡坑死了！
2,/p/3841645057,求各位大神帮忙，
2,/p/3811691748,人死后存邮政储蓄卡问钱怎么取
1,/p/3840172291,邮政储蓄卡绿卡通借记卡2012/09有效期是多少
2,/p/3883915608,我用我爸的身份证办的卡，绑定的是他号码，现在我拿他的身份证能
1,/p/3878085804,邮政储蓄和邮政储蓄银行的差别
2,/p/3829327219,希望你邮政业务员别骗老百性好吗
0,/p/3902113689,求助
2,/p/3897729988,前天在自修存款机上面存了300元，到现在还没到账是怎么回事啊
0,/p/3896426706,谁会修改邮政网银卡登录密码！
0,/p/3895131575,呵呵，醉了。
2,/p/3811708219,邮政储蓄60快能存吗?
1,/p/3882998571,求购医卡通
3,/p/3840146653,622150364000是哪个地区邮政储蓄
9,/p/2224310037,邮储银行怎么样啊
6,/p/3754115156,用支付宝转账到邮政为什么那么慢？？
1,/p/3820564939,手机号被别人绑定了网银怎么解绑
6,/p/999778436,到邮政储蓄换残币的可笑事
10,/p/3865462752,我靠你爹的邮政储蓄
1,/p/3867044935,关于补办邮政银行卡问题，求解
2,/p/3857446246,我登录微信钱包和支付宝时绑定银行卡都说预留电话不符，怎么办
1,/p/3864847589,问个问题，现在还有一折一卡吗
1,/p/3863454976,紧急求助 潍坊邮政储蓄银行及省邮政储蓄的
0,/p/3863186925,电话银行可以跨行转账吗
0,/p/3862643809,关于交学费
2,/p/3783304078,柜员有义务提醒用户定期是否到期么？
1,/p/3853873692,补办邮政卡
0,/p/3852705032,钱被自动存款机给吞了。
1,/p/3845086802,怎么更换银行卡绑定的手机号。
1,/p/3717018849,邮政储蓄卡交费时要输的交易密码是卡的密码吗?
0,/p/3840122449,622150364000是哪个地区邮政储蓄
1,/p/3829517634,请各位大神帮帮忙
0,/p/3829762137,邮储网上银行里签约的理财如何取消签约？
0,/p/3829753817,求问
0,/p/3829524160,请大神们指点
0,/p/3820080587,才准备干邮储客服的，有人有95580的知识库吗
0,/p/3818117087,还差一个月16岁能办卡呢?
0,/p/3818058552,求大神
4,/p/3793124811,邮政16岁持本人身份证
0,/p/3808319657,问问一个问题
3,/p/3735883889,有懂atm机的没有
1,/p/3778772666,我没有邮政储蓄银行的银行卡，我可以去邮政储蓄银行营业厅进行跨转
4,/p/3728230896,邮政为什么老是开会
1,/p/3787524329,一张身份镇可以办几张邮政储蓄卡
3,/p/3727404665,我满16岁怎么不可以办卡
6,/p/3727348129,邮政员工被强制要求包销烟酒，礼品等非本职工作相关的东西
8,/p/3695658858,4.7号办邮政卡接待员让我存31元钱
0,/p/3779443349,大神们来看看，苹果手机充值故障，怎么解决啊
0,/p/3779265383,没用的贴吧，不关注了，退了
1,/p/754324353,如何查存折的明细
0,/p/3774969157,河北省邯郸市涉县邮政储蓄不让员工休息，可比当年给地主打长工
0,/p/3771894160,求人帮我解答！求大家好心呀
0,/p/3769426370,邮政的财富债券理财产品怎么样
0,/p/3764125823,北戴河邮政局的小三，能不能要点脸？
0,/p/3762098681,我想贷5000
4,/p/3755285639,吧友们帮帮我。求你们了。
1,/p/3727296088,烟草邮储信用卡卡号开头是什么数字前九位。
1,/p/3747574659,听说身份证到期了会冻结银行卡？
2,/p/3707660234,求告诉！！
0,/p/3747574133,听说身份证到期了会冻结银行卡？
1,/p/3737126887,新人求助啊
0,/p/3735280794,多久到啊，看图，以前都是第二天八点左右到的。
6,/p/3690032322,邮政真没安全保障！大家都来看看哦
1,/p/3729279310,邮政储蓄的卡能不能刷卡
1,/p/3728156995,邮政小额管理费怎么算？卡里就剩一块多。
0,/p/3727273009,宝祥苑附近有没有中国邮政储蓄银行啊
0,/p/3727248848,我的网银邮政储蓄卡（借记卡）怎么现在的手机系
1,/p/3647240957,邮政储蓄1000元什么时候才会长息
0,/p/3724100519,急需的来，3小时包下3000到10000
1,/p/3599644801,活期存折怎么查余额
1,/p/3720584150,16岁可以办卡了吗？
0,/p/3715550438,6024510012是哪家邮储
6,/p/3504388121,邮政三年定期存款到期后可以在外省取钱或网银转出本金和利息吗？
10,/p/3636921098,他妈的，我办存款被忽悠着办了保险。
2,/p/3712693423,未成年人可以办卡不
0,/p/3708617284,求大神帮助本人黑龙江的
1,/p/3707375586,邮政卡转账问题求解！！！
0,/p/3705926135,收到江西省分行的调剂电话了，真的有调剂么？
3,/p/3699782483,开通网银给我的口令卡干嘛用，每次付款支付都是短信验证码没有要
0,/p/3696291731,求大神指点
2,/p/3695163023,关于预留号码消费信息发送到手机的问题！
8,/p/3640155449,为什么邮政这么坑？
2,/p/3687009668,密码丢失
0,/p/3690391282,邮局卡能异地存款吗
0,/p/3685798370,别人知道我的电话号码有没有可能盗取我卡里面的钱
0,/p/3679997299,我的邮政储蓄卡今天在农商银行的取款机里取钱总
1,/p/3679691919,请问5万的小额信用贷款怎么算利息啊
0,/p/3679529717,浙江省宁波市北仑区邮政储蓄所
6,/p/3159789617,邮政储蓄的坐席专员都干啥？
0,/p/3668206315,手机收不到邮政的验证短信
0,/p/3664233607,我们这邮政存钱送手机   钱存
0,/p/3650476209,贺卡幸运封开奖啦
0,/p/571494971,请问下江西邮政物流速递省公司员工待遇怎么样啊？
10,/p/2492905632,求助，关于邮储跨行异地支票转账收费。
1,/p/3646497118,新人求解 大神帮忙
2,/p/3618708570,求职
1,/p/3650114976,帮帮忙啊 谢谢
0,/p/3650123020,中国邮政储蓄银行转钱后什么时候会通知?
0,/p/3649035408,请问邮政储蓄 能带拉客户的征信报告吗
7,/p/3604735011,邮政储蓄的投诉电话是多少
3,/p/3644397261,求！
80,/p/2306862765,新人来报，求罩······
2,/p/3632962067,新人求解，小额贷款！
1,/p/3621206357,关于银行卡丢失补办取钱
2,/p/3625593654,邮政储蓄存款利率
2,/p/3626370253,邮政卡丢了，补办了一个可是账号和丢失的账号不一样，
2,/p/3637785165,求解答
10,/p/3550409236,这种卡不能开网银么
2,/p/3620749213,有谁经历过转型，
2,/p/3633527094,求助，关于投诉员工工作时间的问题
0,/p/3642591082,大家看看
8,/p/3634977479,我根本就没邮政卡
0,/p/3639781591,支付宝打钱多久到账
3,/p/3629650027,求助！
1,/p/3621211402,邮储银行收款人名册只能储存十个吗?
0,/p/3621132366,求助，关于邮储银行手机客户端
4,/p/3617101999,求解答
0,/p/3617901710,点草别人，不和贵吧有冲突
1,/p/3589950521,南京邮储柜员单年终奖5W？过年休业4天？？
1,/p/3591389841,有在邮政储蓄上班的同志吗？请教个问题！
2,/p/3616510417,急急急！！！！
1,/p/3614140122,浙江绍兴、杭州有羊年生肖卡办理吗？
1,/p/3615038235,手机支付宝绑定不了邮政储蓄卡，咋回事。
7,/p/3608786702,邮政卡只要开网银都能绑支付宝吗
3,/p/3612683603,邮政卡，刚办的，开通手机银行，没有激活，直接受到扣款短信
1,/p/3615035667,手机支付宝绑定不了邮政储蓄卡，咋回事。
10,/p/3553296409,存款十万成为VIP。这十万包括定期，还是全部是活期？
8,/p/3604740473,邮政信用卡
0,/p/3608637810,兴宁中国邮政储蓄银行怎样申请小额贷款
1,/p/2409426735,【求助】IE8 登陆邮政网银无法显示验证码
0,/p/3604743325,邮储存钱送手机活动快递多久能到
0,/p/3604632542,我用手机银行招商银行转账转到邮政储蓄转错了怎么还没退回来
2,/p/3597478202,谁知道这个存款是保险吗？
12,/p/3586998346,现在从支付宝转账到邮储卡还上班处理到账吗
0,/p/3590103028,邮政储蓄贷款问题求解答
6,/p/3546903433,请问进入不了邮政网银的个人网银登录界面，该怎么办？
4,/p/3550800721,这种情况怎么办啊
3,/p/3566561121,存折里还有40块钱能取出来吗
1,/p/3572206980,可以在邮政储蓄汇款到安徽信用社银行卡里吗？
2,/p/3585877042,初来，问个问题！
2,/p/3575896435,问： 20 邮政储蓄一年的定期到了，去银行却被告知无法转存，无法取
3,/p/3580235389,在邮政存款变成人寿保险，
1,/p/3586736552,老爸去邮政存钱，结果拿回来是张银行代理收取保险费凭证
1,/p/3585877575,初来，问个问题！
0,/p/3582976947,邮储银行的卡能看电影吗?
0,/p/3582969587,今晚邮政银行怎么了 登录不了
0,/p/3580312179,请问网汇e不能用了？
11,/p/3500830439,面试视频免费送
0,/p/3570433064,这是什么情况啊
1,/p/3567974229,【抽奖】爱投资送小米啦，疯狂现金免费拿！
7,/p/3534509278,河南的报考邮政储蓄银行的收到面试的短信了吗？
4,/p/3312464605,邮政储蓄汇总压的问题
4,/p/3551973134,报考邮政储蓄山西分行的有收到二面通知的吗，一面没过会给通知吗
1,/p/3550583922,邮政储蓄银行卡边缘有点破损还能用吗
2,/p/3522377064,邮政储蓄白金卡申请条件??有人下卡了没有?
2,/p/3548893998,话说借记卡都可以开网银和支付宝么？
0,/p/3546997238,为什么我有中国邮政储蓄银行中学生资卡却没有钱
10,/p/3257626162,刚进邮储实习柜员一个星期，新人求解答上班前和下班后要做什么
0,/p/3538502261,高手指点这个海南邮政储蓄交易机构号46000014是那家网点
0,/p/3538055852,邮政待遇究竟如何啊？总公司分那几个部分啊？
1,/p/3459775581,谁知道邮政储蓄笔试该从哪些方面复习？菜鸟问。。。跪求有用回复
2,/p/3480413060,邮储笔试
2,/p/3529658033,急问邮政储蓄面试形式！！！
0,/p/3533640693,安徽邮政储蓄2015年应届生招聘
5,/p/2280745811,"邮政储蓄卡丢了挂失之后再打钱在里面,补办新卡之后…"
1,/p/3531851772,求大神帮忙~~~
20,/p/1251869280,我妈去中国邮政储蓄去存钱，存款变成人寿保险！！！
1,/p/3522634213,中国邮政储蓄银行绿卡通借记卡办卡存了一百为什
2,/p/3508153896,被盗刷，怎么整？
0,/p/3522623905,邮政提固定 4-5W 不要有逾
6,/p/3508963821,办理邮政网银后不能用，求高手
3,/p/3513469704,约定转存金额是1000，如果卡里一直不到1000呢？
0,/p/3507132775,安徽   邮政储蓄银行面试  大家加群
0,/p/3496872263,邮政储蓄营业员用储蓄资金垫付其它业务违反了哪款条款
1,/p/3494560606,邮政服务太次了，我想问怎么投诉能有效
1,/p/3487181342,邮政储蓄是至今为止最差的银行…没有之一
1,/p/3300115822,邮益宝，
1,/p/3476856925,自贡邮政储蓄乡镇网点B类正式营业员待遇如何啊?
0,/p/3476873776,邮储财富债券系列的销售文件包括哪些
0,/p/3476767881,邮储赠送的话费劵怎么用?
0,/p/3476767515,！！！！！！！！
0,/p/3476755333,新疆邮政储蓄银行2014年校园招聘考试通知了吗
3,/p/3353983102,邮储网银被盗刷！
0,/p/3474630928,邮政储蓄短信通知
0,/p/3466015590,急急急!!!!真心求助 邮政啊!!!!!!
4,/p/3381289008,邮政储蓄非签约手机银行能在手机上进行定活互转吗？
1,/p/3447201592,求助，卡丢了
7,/p/3424863778,邮政储蓄的校园招聘网申怎么还没通知？
1,/p/3449354611,有事咨询，关于95580问题
1,/p/3441708026,邮政储蓄卡没钱再过几个月冲钱会怎样
1,/p/3443632890,邮政到底有多慢
1,/p/3441709318,吃人的邮政储蓄银行
0,/p/3441702723,邮政储蓄网上银行支付时，老提示验证码错误
0,/p/3440125529,请问，本人拿身份证和存折，去邮政储蓄银行取不出钱是为什么？
0,/p/3439841987,为什么自动存取机给别人存4100
11,/p/3352674482,有河北的吗 你们的快捷支付能用吗
4,/p/3379508257,邮储的银行卡有年费吗？？？
1,/p/3390718198,2014年邮政储蓄办理借记卡有没有年费和小额管理费
3,/p/3188720713,邮政啊  你为啥这么坑爹娘
20,/p/3265122047,中国邮政储蓄个bz，存一次钱，短扣了30，挣黑心钱，雷劈死你.
3,/p/3381315282,想注销邮政绿卡，可是办卡时一起给的存折丢了，这个卡还能注销吗
7,/p/3417260214,信用卡问题
9,/p/3389063746,学校办的卡，丢了，身份证号不是我的？我该怎麽整？
2,/p/3422555417,疑惑
2,/p/3411815002,写哪个密码
9,/p/3367368450,嚣张的中国邮政储蓄银行，不要在上当存钱在这种银行了！！！
2,/p/3397394611,想办张邮政储蓄卡。进来一看，邮政储蓄似乎很吭啊。
1,/p/3378468529,邮政储蓄透支卡欠款一年还上后还能用这张卡吗
3,/p/3390715347,求专业人士推荐邮政储蓄理财产品
1,/p/3397397445,邮政储蓄总行一个处长年薪多少
3,/p/3399904124,花十几万进邮政储蓄长期合同工值不值，急急急急急
0,/p/3417516604,全世界最烂的银行邮政储蓄代理银行
0,/p/3415153244,邮政储蓄信用卡分期的问题，着急着急
5,/p/3392621837,求助！！！
4,/p/579361470,邮政储蓄财富月月升理财产品，终止投资10天还没到帐？
0,/p/3403244642,来大神看一下这是咋了
0,/p/3395164035,收2015年及往年幸运封等邮资票品
3,/p/3393929150,懂得人赶快进来，急急急！
0,/p/3394382006,邮政储蓄贷款
3,/p/3363682581,定期存款单忘记密码怎么办？
5,/p/3386303026,老子真是受不了邮政，快捷支付到现在支付不了，也没有时间答复
5,/p/3386315421,求助
8,/p/3378522755,"邮储银行这两天无法提现,为什么公告里没有"
2,/p/3363040548,老子受不了邮政了
1,/p/3297676138,询问
0,/p/3378517833,邮政储蓄普卡可以用农行的网银直接还款吗，有没有收取手续费
1,/p/3241582105,新系统网银怎么追加其它账户
0,/p/3371779168,求助，如何查询钱去哪里了
0,/p/3365993668,"朋友用支付宝宝转钱到我卡上,怎么还没到呀？"
4,/p/3329028222,存的明明是自动转存，存好后却是约定转存
19,/p/178575833,"全世界最烂的银行,邮政储蓄!"
9,/p/3352820735,支付宝快捷支付怎么不管用了
1,/p/3353659169,ATM存钱，钱吞了，没成功，给了一张小票。起怎么办
2,/p/3352459582,邮政绿卡往支付宝充钱收不到验校码
0,/p/3353880873,好贷网吧--欢迎大家到好贷网吧畅聊贷款相关经验
3,/p/675201493,邮政储蓄和保险所合并了 快来看
0,/p/3347191949,存折和银行卡是不是一回事？技术银行卡锁住了存折也能用吗？
1,/p/3348792739,请问邮政储蓄存折在异地可以密码挂失和重置吗？
0,/p/3348794684,中国邮政储蓄银行三连保怎么
1,/p/3337440515,申请退保的流程是什么，几天钱可以到账啊
0,/p/3342640971,卡里还有76，今天后起脸皮去取出来
1,/p/3324114286,大学生村官考录邮政银行
0,/p/3335918647,求助！急！
0,/p/3333064479,邮政银行系统有漏洞，顾客经常少钱
6,/p/3252475057,去邮政储蓄存钱竟然被骗买保险，怎么办？
0,/p/3322595670,太烦躁了，
1,/p/3290276582,大专生可以考邮政不
9,/p/3162793859,十几年的存折，还能取出钱么？请回答，谢谢。
1,/p/3306034691,大学生邮储网络支付与理财创新
1,/p/3307068482,邮政储蓄银行伪造录像
5,/p/3170665941,邮政储蓄客服态度真差
1,/p/3139949945,xi 说高河邮政储蓄
3,/p/3309951900,为什么我的邮政储蓄卡干什么都没权限
0,/p/3309578582,求助，外地办的卡，现在回本地了怎么注销
1,/p/3308524358,昨天用邮政储蓄卡在自动存款机充了三百块为什么
2,/p/3175779027,垃圾啊 现在连网站都打不开了，邮政你还能特么干点啥
1,/p/3279088611,邮政储蓄你们要不要脸了？？？
0,/p/3302081729,求助   邮政卡能不能绑定财付通？
0,/p/3287043183,9月9日17:52从晋商银行实时跨行转账到邮政
0,/p/3285080983,求助，支付宝转账邮政，两天了都还没好，是什么情况。
0,/p/3280846995,南京邮政房贷驻地军官不给贷款吗
10,/p/3172566187,逻辑系统 怎么用卡查询开户日期
5,/p/3138918564,邮政储蓄
0,/p/3279091765,现在房贷到邮政储蓄贷138000仟按5年每月要付多少
1,/p/3269415971,多扣我30块钱
2,/p/3156278028,办邮政的银行卡限制年龄吗？开通网银呢？
4,/p/3148992578,这个怎么回事
3,/p/3180250697,自己给自己办理业务
3,/p/3250850480,帮我解决问题可好？
6,/p/3123110256,2014年（6月版）邮政储蓄存款1000元赠送联想手机
1,/p/3250450427,绿卡通IC金卡为什么办不了免费短信
0,/p/3249802184,求急！！！
0,/p/3248064036,"转贴:邮政,呵呵_邮政储蓄吧_百度贴吧"
1,/p/3245965035,我想问问邮政支持发手机吗？一体机
0,/p/3246921025,存1000送手机
2,/p/3227614717,以后还有电子汇兑大集中系统吗  是不是都合并到逻辑大集中里了
0,/p/3240842012,短信验证码
7,/p/2752792413,网上银行转账收不到短信验证码怎么办
8,/p/3226143020,想办张邮政卡
2,/p/3227958819,求大神赐教！跪求！急！
1,/p/3217694126,我被别人骗了、在取款机按照骗子的操作，结果银行卡里钱全没了、
1,/p/3226311342,怎样能在网上查询中国邮政储蓄银行的余额？谢谢
2,/p/297990055,邮政储蓄
0,/p/3220331229,怎么查询网点请领凭证的流水号 ？
0,/p/3215875109,转贴:辛集邮政储蓄银行涉嫌恶意拖延支付优抚金~!_辛集吧_百度贴...
2,/p/3210214445,关于银行预留电话
0,/p/3210324640,银联在线支付
0,/p/3208762527,理财经理号怎么查
8,/p/605450463,邮政储蓄的转账凭单太不人性化
1,/p/3079189816,我是邮政绿卡通华西健康卡，不小心把钱冲到电子现金里，怎么取出
1,/p/3197425564,老子必须吐槽！！！！
0,/p/3192554300,我开通了网上银行但没有开通短信服务，每个月还需要交钱吗，类似农
2,/p/3162057133,怎么查询机构号
1,/p/3190985296,邮政储蓄卡买票还掏现钱吗
23,/p/2919456378,邮政，呵呵
0,/p/3188728913,邮储信用卡中奖怎么查
2,/p/3183575096,求助
0,/p/3180086060,邮政储蓄真垃圾!!
0,/p/3178484903,又要检查了！
0,/p/3177944142,逻辑系统切换预演问题 急急急！！！
1,/p/3173608019,今天上午办的邮政卡存了100 下午被扣了30 应该是短信服务
14,/p/3172141534,跨行网上转账一般多长时间到啊，
1,/p/3159397316,邮政卡丢失可不可以直接去网点把钱取出？（95580今天停服务了）
2,/p/3147895028,问个问题 是邮政储蓄卡密码输错3次
2,/p/3157108747,新系统里的清户 折 卡 存单 需要交回事后吗
1,/p/3161311562,深圳邮政储蓄银行无线是干什么用的？
0,/p/3167543450,能批量开卡吗，求解！！！
2,/p/3164690355,急！急！急！周六晚我姐支付宝转的账到我的邮政卡，现在还没到
22,/p/2996906830,号码与银行预定的号码不一致的问题我帮你们解决
1,/p/3158478445,建行转邮政今天12点转的，要多久呀？？
0,/p/3157027336,邮政储蓄包裹拿不到！怎么回事？
0,/p/3156781037,梁山邮政储蓄孔春英
2,/p/2989488171,我用邮政卡绑定支付宝
1,/p/3150482056,新系统每天怎么才能知道自己网点的余额
0,/p/3149846917,急，求助
7,/p/3100375287,邮政储蓄竟然出假钱。大家有没有这种现象发生呢
0,/p/3145668401,邮政储蓄借记卡为什么在提款机上不能查询和取款
6,/p/2978039277,支付宝里的快捷支付不支持付款了，以前都可以的呀，
2,/p/3144361448,今天邮政储蓄快捷支付暂停服务？转账都转不进去
4,/p/3063123842,关于逻辑系统上线
2,/p/3014741232,求一类和二类网点的区别
1,/p/2934823590,我未成年，有身份证，到邮政储蓄来个户头可以吗
1,/p/2960383194,邮政储蓄落后N久，太麻烦了！！！
3,/p/2969412868,你们二类网点还能干点什么？
3,/p/2950542580,邮政储蓄工作人员失误，导致本人信誉度受损，我
2,/p/3112552196,求助（我的邮政卡有钱。去柜台上面问她说可用余额是0）
1,/p/3131593202,邮政储蓄的亲们，说下你们的工资
4,/p/3057053805,存两年死期5000元可以换一部苹果？
3,/p/3117188344,邮政储蓄ATM取假币怎么办？
0,/p/3117605442,求助。
0,/p/3111084906,☞打工心态废掉了很多人 看看吧
0,/p/3111056379,☞中国式纠结，总结很精辟！(真
0,/p/3111035515,《找老公，找玩够的 . 找老婆
9,/p/266339006,邮政储蓄啊 邮政 所有银行中垃圾中的战斗机
0,/p/3107538738,请教各位朋友，谢谢！
0,/p/3101046552,邮政储汇业务员考试
0,/p/3099266164,越爱越容易吵架（早点看）...
1,/p/3086290398,难道邮政储蓄只是卖东西的吗，还在实习期就问能不能卖出去中秋的
0,/p/3094020830,在邮政储蓄网站哪里可以找到开户预留信息
0,/p/3094017489,乘风破浪 【经典句子】：吃过苦
0,/p/3092773806,求解答
0,/p/3092488204,有比邮政网银更坑的吗
0,/p/3083910750,能在营业厅挂失的卡就一定能把钱取出来吗
0,/p/3083359262,邮政储蓄存款回单没盖章有效吗？
3,/p/3046034893,邮政储蓄劳务工好吗？
1,/p/3029117291,uk密码忘记，证书补发，下载不了
1,/p/3034446758,我98年12月的能办银行卡嘛，
1,/p/3069403601,邮储银行卡 还剩198元 取100扣钱吗？
